{
  "$schema": "https://json-schema.org/draft/2020-12/schema",
  "$id": "agent-workflow/schemas/workflow_checkpoint.schema.json",
  "title": "WorkflowCheckpoint",
  "description": "Durable recovery anchor written after important lifecycle transitions. Recovery truth — can be reconstructed from EventLog + Registry.",
  "type": "object",
  "required": [
    "schema_version",
    "checkpoint_id",
    "workflow_run_id",
    "work_item_id",
    "phase",
    "state",
    "attempt",
    "artifacts",
    "event_id",
    "created_at",
    "checksum"
  ],
  "properties": {
    "schema_version": {
      "type": "integer",
      "const": 1,
      "description": "Schema version for forward compatibility."
    },
    "checkpoint_id": {
      "type": "string",
      "pattern": "^ckpt_",
      "description": "Globally unique checkpoint identifier, prefixed with 'ckpt_'."
    },
    "workflow_run_id": {
      "type": "string",
      "pattern": "^wfr_",
      "description": "Parent workflow run identifier."
    },
    "work_item_id": {
      "type": "string",
      "description": "Work item this checkpoint belongs to."
    },
    "phase": {
      "type": "string",
      "description": "Pack-registered phase when this checkpoint was written."
    },
    "phase_category": {
      "type": ["string", "null"],
      "description": "Optional common category for cross-pack queries."
    },
    "sub_phase": {
      "type": ["string", "null"],
      "description": "Optional pack-local recovery/query detail."
    },
    "state": {
      "type": "string",
      "enum": [
        "PENDING",
        "RUNNING",
        "WAITING_APPROVAL",
        "FAILED",
        "COMPLETED",
        "CANCELLED"
      ],
      "description": "Core state at the time of this checkpoint."
    },
    "attempt": {
      "type": "integer",
      "minimum": 1,
      "description": "Attempt number, starting at 1."
    },
    "artifacts": {
      "type": "array",
      "items": { "type": "string" },
      "description": "List of artifact_id references known at this checkpoint."
    },
    "event_id": {
      "type": "string",
      "pattern": "^evt_",
      "description": "The event that triggered this checkpoint write."
    },
    "created_at": {
      "type": "string",
      "format": "date-time",
      "pattern": "^\\d{4}-\\d{2}-\\d{2}T\\d{2}:\\d{2}:\\d{2}[+-]\\d{2}:\\d{2}$",
      "description": "ISO 8601 timestamp when this checkpoint was created."
    },
    "checksum": {
      "type": "string",
      "pattern": "^[a-f0-9]{64}$",
      "description": "SHA-256 of the checkpoint content (excluding this checksum field). Used for integrity verification during recovery."
    }
  }
}
