{
  "schema_version": 1,
  "checkpoint_id": "ckpt_retry_started_001",
  "workflow_run_id": "wfr_test_001",
  "work_item_id": "step2",
  "phase": "REVIEW",
  "phase_category": "REVIEW",
  "sub_phase": null,
  "state": "RUNNING",
  "attempt": 2,
  "artifacts": [],
  "event_id": "evt_retry_started_001",
  "created_at": "2026-06-08T12:15:00+08:00",
  "checksum": "a7ffc6f8bf1ed76651c14756a061d662f580ff4de43b49fa82d80a4b80f8434a"
}
