{
  "schema_version": 1,
  "checkpoint_id": "ckpt_review_completed_001",
  "workflow_run_id": "wfr_test_001",
  "work_item_id": "step2",
  "phase": "REVIEW",
  "phase_category": "REVIEW",
  "sub_phase": null,
  "state": "COMPLETED",
  "attempt": 1,
  "artifacts": [
    "strategy_system_workflow_v1.step2.plan-review.v1"
  ],
  "event_id": "evt_checkpoint_written_001",
  "created_at": "2026-06-08T12:01:00+08:00",
  "checksum": "e3b0c44298fc1c149afbf4c8996fb92427ae41e4649b934ca495991b7852b855"
}
